Model,YTD%,Commentary
US Large Cap Growth,15.2,"Leading innovation companies showing robust earnings growth with strong balance sheets"
Technology Sector Focus,12.5,"AI and cloud infrastructure investments driving exceptional performance this quarter"
International Developed Markets,8.3,"Benefiting from currency stabilization and European economic recovery trends"
Real Estate Investment Trusts,9.7,"Solid dividend yields with capital appreciation in commercial real estate recovery"
Small Cap Value,6.8,"Attractive valuations in quality small-cap names with strong fundamentals"
Commodities & Energy,11.3,"Energy transition and commodity supercycle themes creating long-term value"
Fixed Income Core,4.1,"Stable returns providing portfolio ballast in volatile market environment"
Emerging Markets,-2.1,"Temporary headwinds from geopolitical concerns, positioned for recovery"
